source,review_id,user_name,review_title,review_description,rating,thumbs_up,review_date,developer_response,developer_response_date,appVersion,language_code,country_code
Google Play,69cff81a-e6b8-4f5e-aecc-8d8f458121b5,A Google user,,so helpful for tracking spending!!,5,0,2019-07-12 14:27:29,,,3.14.1,en,us
Google Play,b9350207-c36a-419f-9b12-2bb57c84397a,A Google user,,"Easy setup and use, right to the point w/out fluff, easy to categorize and customize categories, like custom notifications and easy to see current category totals, look forward to full release so i can share it w others",5,3,2019-07-11 13:17:05,,,3.14.1,en,us
Google Play,28f98c61-c563-42f4-b2f8-c7630bb94cca,A Google user,,very good tool to help my budgeting. easy to use and very thorough. highly recommended,5,5,2019-07-11 02:33:32,,,3.14.1,en,us
Google Play,7c6a2717-fe42-46be-97b0-9390ecedfdb8,A Google user,,"It would not add accounts, kept telling me wrong credentials even though I had just logged into those accounts using the same credentials. Poor connectivity. Kept saying to try back in a few hours. Waste of my time.",2,0,2019-07-09 01:34:39,Hi Kimberly! We sincerely apologize for the troubles you've had with the app. Our support representative has reported the issue to our data aggregation partner for further investigation. We will contact you as soon as we have any updates.,2019-07-09 08:00:41,,en,us
Google Play,344b4141-b377-42e0-bfd1-c7ef49bf33e7,A Google user,,simple to use,5,0,2019-07-06 22:53:07,,,3.14.1,en,us
Google Play,6a245268-1765-4c26-9f47-7ede6a3889ce,A Google user,,"I love this app! I usually think I need to write down everything I bought myself but with PocketGuard's bank linking technology, I no longer have to worry about recording eveything. It's super useful and I highly recommend this app for budgeting and for finding new ways (provided by PocketGuard) to make and save money",5,1,2019-06-28 21:55:52,,,3.13,en,us
Google Play,1f53eb0d-8bec-41bb-86b8-76121135d136,A Google user,,Easy to use. Less confusing than Mint. Snap shot of finances for planning. Great tool for those who want to see where their money is going and how much rhe can spend each day.,5,0,2019-06-25 14:53:33,,,3.13,en,us
Google Play,ad97cf07-fbd5-4b36-affd-3d35a09b41c2,A Google user,,This app is amazing! Just what I was looking for.,5,0,2019-06-23 22:12:35,,,3.13,en,us
Google Play,3ccf6525-eeb0-444d-93ee-4d8bc318a1c4,A Google user,,garbage...i will never give an app access to my bank account! insane! I have deleted,2,0,2019-06-23 17:01:23,"Hi Shirley! PocketGuard transfers data with the same security level as your banking application. We use the same 256-bit SSL and advanced Encryption standards as banks and other financial institutions. So it is completely secure to connect your accounts to the system! If you have any questions, feel free to contact us at support@pocketguard.com.",2019-06-24 15:07:59,,en,us
Google Play,1222a6bc-6d2f-43f7-bc81-e58b1495d1e6,A Google user,,so good,5,0,2019-06-23 05:04:00,,,3.13,en,us
Google Play,ceb6c45a-7bf2-4d6f-92a7-ee09c7d59527,A Google user,,"I've been using this app for about 2 or 3 years now, and I can't recommend it enough. They've been adding new features the whole time and know what is useful. Great for those that have automized bills and have a predictable income, but it's versatile for many more financial situations. Saving money is so easy with this app.",5,7,2019-06-18 12:18:30,,,3.13,en,us
Google Play,2d6c86d7-41e6-4335-b0d5-5dcccd9c92b6,A Google user,,excellent!,5,0,2019-06-18 11:51:10,,,3.13,en,us
Google Play,f6d720b8-744a-4423-a894-0c24f33d17e1,A Google user,,"Would be perfect if I can change dates on transactions OR if I get to choose when my ""monthly"" budget starts and ends. It has to do with when I get paid so my budget runs from the 25th to the 25th. It says ""change date"" option is coming soon. When they do that, this app will be the benchmark of budgeting/money management apps. Right now the monthly tally it gives me is little use to me without doing some math on my own.",4,6,2019-06-16 17:00:19,,,3.13,en,us
Google Play,b20ac87b-297c-4ebd-ad76-e1ca08bc156a,A Google user,,good app everything is easy to see. will update this comment as I go along.,4,0,2019-06-16 15:18:34,,,3.12,en,us
Google Play,2c950e53-4a8c-495a-a4be-874d79adc3b3,A Google user,,takes a second to understand but all in all a great app,5,0,2019-06-16 07:19:33,,,3.13,en,us
Google Play,436cf507-e058-482d-8532-51e8dc869a75,A Google user,,"the main reason I cancelled were the incessant syncing issues. maybe if I didn't have like 12 accounts that wouldn't be a deal breaker but i just wasn't getting anything out of the app. it did motivate me at first, it was easy to use - just tedious. it seemed secure, but unless I am getting a lot out of the app it's hard to justify repeatedly sharing such important personal finance info.",2,0,2019-06-15 12:57:32,,,,en,us
Google Play,dd911d13-ef24-4dff-b673-0abd61f625ec,A Google user,,"I'm always adding my money all the time, guessing high to try and keep track of how much I'm actually saving each month, this honestly makes it easy. The best part is when you go to add your bills is syncs with your bank and shows you everything that comes out. All you have to do is drag and drop!",5,1,2019-06-15 10:55:28,,,3.13,en,us
Google Play,3fe69722-2577-4aec-9917-cd510b405898,A Google user,,Their customer/tech team is very responsive and helpful! I enjoy the app but is sometimes hard to visualize the entire spending for the month once you click on one of your expense categories.,4,1,2019-06-13 22:15:47,,,3.12,en,us
Google Play,2acb36ff-bad4-4866-b9d9-3ca5a15a45ed,A Google user,,good,5,0,2019-06-13 17:10:34,,,3.12,en,us
Google Play,0555db8c-b1af-4549-a2dd-bad2d96ae627,A Google user,,Nice design but could not connect to my bank due to an Aggregation error and customer service never respomded.,1,0,2019-06-13 16:46:31,"Hi there! Sorry for the inconvenience. Our support representatives will contact you shortly. Also, please check the spam folder as our email could get there. In case you still don't get the email, update the review and specify the email we can reach out to you.",2019-06-14 07:39:01,,en,us
Google Play,672e1caf-8aa0-4533-8204-333fa4840656,A Google user,,"This app can be described in two words ""Aggregation error."" I used it for nearly a year hoping it would improve, but it's ability to connect to your various accounts is too inconsistent to make it worth it. I'll be looking elsewhere for this service.",1,1,2019-06-12 14:17:43,"Hi Tyler! We have reported the errors to our data aggregation partner and our support representative will contact you when we have any updates on the cases. Also, feel free to contact us at support@pocketguard.com.",2019-06-14 07:51:14,3.9.3,en,us
Google Play,860f06f0-8789-45df-91e3-07a3ea700706,A Google user,,"I've had this for 3 months. I was very cautious choosing an app. I didn't want to waste my time on something that would be complex, time consuming and eventually useless. My expectations have been exceeded! It's simple, fast, intuitive, and already it's helping me understand where my money is going! So glad I found it!",5,0,2019-06-10 23:49:38,,,3.12,en,us
Google Play,fb7fc1a5-01ba-4de9-9d57-ce421276b0b6,A Google user,,I love it.,5,0,2019-06-10 21:49:31,,,3.12,en,us
Google Play,973ee820-5ddf-4ed2-ada7-6afabab95f35,A Google user,,yay,5,0,2019-06-10 04:12:37,,,3.12,en,us
Google Play,686ceb6b-c0d4-46b9-bf98-bffe0d07c759,A Google user,,"overall, very happy with this. It's good for tracking, monitoring, and review the movement of your money in your various accounts",5,1,2019-06-08 12:42:50,,,3.12,en,us
Google Play,e4409e32-8bd8-455f-a483-efc0ef81154d,A Google user,,"great app, helps keep me on budget.",5,0,2019-06-07 13:57:03,,,3.12,en,us
Google Play,51db9d2e-4c0a-4f76-b8c5-2c9ceb23df0a,A Google user,,"Great app, easy to track expenses",5,0,2019-06-07 12:22:15,,,3.12,en,us
Google Play,c216f198-82d2-4617-8348-fbc95cde7560,A Google user,,"Effortless money management, complete with automatic bank syncing, auto categorization (with overrides), tagging, and good reports.",4,0,2019-06-06 18:12:43,,,3.12,en,us
Google Play,b567cad2-0800-412c-a879-cad0e8bb17a8,A Google user,,easy to use and understand,5,0,2019-06-05 23:14:55,,,3.12,en,us
Google Play,59f677b9-0a1b-4836-8a6d-0f6510dea0b9,A Google user,,"Really easy to use, I've tried a lot of apps but this one is pretty awesome. I'm just starting out with it so we'll see how it goes. Wondering if the app notifies me if a bill is due or upcoming. if not, it would be a great feature to add! Also a sync to calendar would be a plus! I'm on my free trial right now, hoping I like it because I need to get on track.",4,0,2019-06-05 17:31:40,,,3.12,en,us
Google Play,f65d168d-3c75-4058-9e64-68cbfc8927a4,A Google user,,"update: It is hard to find the transactions that are not in catagories and their sum. Navigation needs work. Hopefully in next update. So is in your pocket your available balance? Then how does the Cash relate to that? otherwise good. thx. Unbreakable! Easy, clear. You can create your own categories. Drill down for more granular info. Quick light install. 4 dollars a month. I gave up on YNAB. Happier now.",3,3,2019-06-05 04:10:35,Hi Anthony! Our support representative has contacted you to find out some additional details regarding navigation and searching transactions. As for the In My Pocket and Cash: we include your Cash rollover into the calculations (optional). Cash Rollover is the cash balance remaining from the previous month.,2019-06-06 14:41:32,3.12,en,us
Google Play,99131250-5488-48ae-aece-15f09c8885a2,A Google user,,great finance tool!,4,0,2019-06-04 14:54:51,,,3.11,en,us
Google Play,badf7c89-0046-484f-83c9-fb1047a88bf1,A Google user,,so far this is the best money management app I've had!,5,0,2019-06-04 11:24:14,,,3.12,en,us
Google Play,cd0d3cb6-8bf8-4c5e-a42c-f317689120bb,A Google user,,This app is great! No complaints.,5,0,2019-06-03 16:10:37,"Hi Jennifer! You need to go to Plan &gt; Bills and skip the upcoming bill you've paid in the previous month. Swipe left on the bill and tap ""X"". The next due dates will be set for the next month. If you have any issues or questions, please contact us at support@pocketguard.com. We are at your service!",2019-06-03 07:33:43,3.12,en,us
Google Play,87abbb18-114d-4dd6-8c75-cadc292065dc,A Google user,,Finally a financial app I love and can use.,5,0,2019-05-30 20:25:57,,,3.12,en,us
Google Play,2681dfe8-21ef-4508-b0ee-edd727429c18,A Google user,,great app,5,0,2019-05-30 00:56:49,,,3.11,en,us
Google Play,982d417e-fb5b-46ad-9aa4-056dff3a0ce4,A Google user,,user friendly,3,0,2019-05-28 03:28:22,"Hi Sarah! If you have any issues or questions, please feel free to contact us at support@pocketguard.com. Our support representative would be happy to assist. We are looking forward to hearing from you!",2019-05-28 14:29:45,3.11,en,us
Google Play,9ba697e2-cea2-44fd-9781-6423fcba50d8,A Google user,,Awesome. Actually tracks everything. Who has time to enter all the data? Not me.,5,0,2019-05-27 13:54:30,,,3.11,en,us
Google Play,00c45d49-fbe3-48b1-b2f6-ce368a29b000,A Google user,,Good so far but having to relink my bank more than I'd like.,4,1,2019-05-25 23:21:48,,,3.11,en,us
Google Play,45aab1d2-e139-439b-a847-718e850f8327,A Google user,,connects to my bank account. will be a life saver,5,0,2019-05-24 22:56:42,,,3.11,en,us
Google Play,dff2fd64-3e84-4675-b3ef-5158feb193ff,A Google user,,"Powerful, simple, intuitive budgeting app I've used all of the major budgeting apps, mint, YNAB, and more. they just start getting too complicated which means I end up not using them. Pocketguard does all the heavy lifting but still keeps me involved, the hashtags make it easy to get reports, and the web app does just what I need when I don't want to stare at my phone. the only thing I'm missing is printable reports. they give you the reports you just can't print them. I pair this with qapital.",5,1,2019-05-24 14:13:56,,,3.11,en,us
Google Play,39c7c866-0036-4590-b1fc-e3326c5f5644,A Google user,,great for managing finances,5,0,2019-05-20 13:33:45,,,3.11,en,us
Google Play,2ae3787e-3275-4382-acbe-e4d703ffacfb,A Google user,,very intuitive. simplifies tracking your finances relative to something like mint. categorization ai is the best I've found so far.,4,0,2019-05-19 03:33:22,,,3.11,en,us
Google Play,58e454d4-e41c-428e-858c-9d470613b91a,A Google user,,the best budgeting app by far. no other app lets me easily categorize my transactions on the go as easily as this app. my only knock against it is the inability to split up transactions. if i paid for dinner and my friends paid me in cash i want to indicate that in the app. hopefully they add this and ill start paying for it! edit: thanks for the response pocket guard. thats not exactly what i meant though. id like to change a CC transaction from its original value ($50->$25 for example),4,0,2019-05-17 14:42:09,"Hi Ashok! You can create cash transactions manually in the current version of the app. Go to the Transactions and tap ""+"" sign. Find out more info here: https://help.pocketguard.com/hc/en-us/articles/360002196479-Cash-transactions. Also, feel free to contact us at support@pocketguard.com if you have any questions.",2019-05-17 10:16:29,3.11,en,us
Google Play,dd6b2dc1-b463-4612-991f-2e550519be30,A Google user,,easy to use very helpful,5,0,2019-05-17 03:18:09,,,3.11,en,us
Google Play,46b0c2b5-b099-4a1d-9b43-8e457652c848,A Google user,,"It is easy to manage your finances and track what your credit cards, checking account & loans.",5,0,2019-05-15 10:16:43,,,,en,us
Google Play,cfd16557-edf2-4d54-b5d2-7bd8c9015998,A Google user,,"Easy to read, easy to use. Wish my bank accounts would update a littke faster.",4,0,2019-05-11 23:08:29,Hi there! Could you please contact us at support@pocketguard.com and specify the name of the account?,2019-05-17 10:17:21,3.11,en,us
Google Play,2d9e1f06-c038-411f-b59a-d6f742557c69,A Google user,,"I love the easy to use interface, which also has a cleaner look than other apps like this. it's great to have complete control of your finances. from keeping track of your accounts to setting up spending budgets it easy and convenient. I recommend getting this app!",5,0,2019-05-10 12:24:43,,,3.11,en,us
Google Play,3117d73b-4b48-42c5-938f-a0487050ec22,A Google user,,i like it,5,0,2019-05-07 14:28:32,,,3.11,en,us
Google Play,bbe45077-45cd-4522-9dd6-ba27952d8c7e,A Google user,,"I'm still new to the app, and so far this is the best app for what I need. I haven't ran into any problems yet like I have with dozens of other apps. I hope by next month my opinion is the same. The cash account seems like a feature that will be very useful.",4,1,2019-05-02 17:16:51,,,3.11,en,us
Google Play,12075b6e-afc2-41ee-85bf-712952e9b749,A Google user,,cant even use the stupid app because it says to update but there is no update feature. wth,1,0,2019-05-02 15:27:02,"Hi Christina! The update request you received means you need to update the app through Google Play. Please see https://support.google.com/googleplay/answer/113412?hl=en for instructions. In case your device doesn't support Google Play Services, you can still access PocketGuard through our website.",2019-05-03 13:32:15,3.7.4-legacy,en,us
Google Play,86f3a42b-4976-4a6e-99aa-e4df8b1f7146,A Google user,,easy bank sync and does everything i need it to do,5,0,2019-05-02 06:12:34,,,3.11,en,us
Google Play,3109a0f4-186f-4312-b525-b93a09478ed8,A Google user,,I have tried so many money management apps. until recently I was an everydollar fan. this app is both free and more useful.,5,0,2019-05-02 01:21:21,,,3.11,en,us
Google Play,6a0348e7-e6c3-49ee-9946-b5e6a87317c4,A Google user,,"i like the very simple design, i dont need extra detailes features, just show me the numbers! but i think they need go make the ""in your pocket"" number customizeable to your own pay date.",5,0,2019-04-29 04:33:03,,,3.11,en,us
Google Play,9feb5ecd-cf0d-442b-a2d6-37e56673e9d6,A Google user,,"Simple, easy and intuitive",5,0,2019-04-28 16:55:49,,,3.11,en,us
Google Play,7073fa46-bc91-42ba-bb94-4ebb97d7e613,A Google user,,"love the hashtags, makes knowing where my money went so much easier!",5,0,2019-04-28 13:44:26,,,3.11,en,us
Google Play,c2146fe8-a20a-40fd-a0ce-51ca74c8718e,A Google user,,great app all it needs is my credit score and I'm a happy man,5,0,2019-04-26 07:03:07,,,3.11,en,us
Google Play,a96565bc-ba54-4e5a-8cc1-8f2040738290,A Google user,,doesnt work,1,0,2019-04-20 15:16:18,"Hi Ciaran! Apologies for the delay in replying. Our support representative has contacted you, so please, check your inbox. We will do our best in resolving your issues as soon as possible.",2019-05-06 08:28:24,3.10.0,en,us
Google Play,0c1350f4-62d9-40a0-a196-6d3e5eb68e02,A Google user,,"Great way to track spending and refine my budget. The best budgeting app that I've found so far. I highly recommend it. 4 stars, because of the exclusion of some features without purchasing the paid version. I don't mind the ads and would suggest that no features be excluded and that the paid version be an ad free option.",4,9,2019-04-19 18:00:39,,,3.10.0,en,us
Google Play,ceca785b-f9e5-4593-ab1f-0a20b04d5704,A Google user,,Simple and easy to use but still has plenty of customizability if getting a Plus account. Tried many other budgeting/bank tracking apps and can't emphasize how much recommend this one.,5,0,2019-04-19 01:44:11,,,,en,us
Google Play,a9c5b5cc-b0a1-46a0-96cd-da90630813fb,A Google user,,This is by far the best money tracking app I've ever used. after Level Money got shut down I tried at least a dozen other apps but couldn't find anything similar. Every other app wants to overcomplicate things and this is just simple money in/money out system. My only complaint is I can't seem to get the tagged transactions function to work and it shows up blank which is fine becuase it's not a 100%necessary feature,5,0,2019-04-12 21:45:47,,,3.10.0,en,us
Google Play,dac213ab-3c5e-4ae2-b0e9-4debde0a2494,A Google user,,"I was able to add ALL off my accounts, retirement included.",5,0,2019-04-11 23:44:30,,,3.10.0,en,us
Google Play,8fd67689-dd08-4bb9-bb78-4a2dfe28a118,A Google user,,I tried adding accounts. Most wouldn't work even though they were on the list. Tried adding pay manually but it would automatically change the dates to sometime in the future instead of the day I selected. The app didn't work well overall.,1,15,2019-04-11 20:42:14,"Hello Edward. Could you please contact us at support@pocketguard.com and specify the name of the accounts you were unable to connect? Also, please specify the name of the bill you tried to add (select date issue). We will do our best to fix these issues for you and hopefully, you will change your mind!",2019-04-12 09:42:09,3.10.0,en,us
Google Play,f767a13b-fbc5-4a34-a9c3-0f24862b9aea,A Google user,,Helpful,5,0,2019-04-07 15:46:07,,,3.9.3,en,us
Google Play,3cf8d23c-ee85-447f-a5fc-60f60c7e515c,A Google user,,only works with defined bank accounts. So no.,1,0,2019-04-05 22:24:26,"Hi Sobhan! At the moment PocketGuard supports more than 18000 institutions from the US and Canada. If you were unable to locate your institution, please contact us at support@pocketguard.com and provide us with its name and login page web address. Once we collect a number of requests, our data provider will start negotiating with your institution.",2019-04-06 08:30:42,,en,us
Google Play,27cfe431-b8b5-4971-9218-0866b692b1f3,A Google user,,keeps me organized and on track to my goals!,5,0,2019-04-04 17:32:19,,,3.9.3,en,us
Google Play,583757bf-6a10-484f-b073-43a791babf0e,A Google user,,Frustrating App!! This app was rated as one of the 10 best! I have not been able to experience this because I can't even get passed the sign up process. I have been trying to link my bank account to this app for several days now each with 15 attempts or more at least to do so. I have tried my phone as well as my tablet to connect with no success. I think I will move on to the next one on the 10 best apps list!!!,1,2,2019-04-02 00:54:00,Hi Tonie! Navy Federal Credit Union has made some changes in the multi-factor authentication method they use. Our data provider's engineers are working on the fix directly with your institution's engineers. You can either temporarily disable the MFA and try to connect the account or wait for the update from our support. Sorry for the inconvenience!,2019-04-02 07:50:05,3.9.3,en,us
Google Play,1798eca4-af91-433a-bf00-2c5ad4b05b0c,A Google user,,One of the best and easiest tracking options out there.,5,0,2019-04-01 11:33:05,,,3.9.3,en,us
Google Play,7b28775e-e063-4546-a988-3cbd4495f903,A Google user,,I enjoy being able to look at different up to date accounts for different banks to help get a quick daily snapshot.,5,0,2019-03-28 14:04:35,,,3.9.3,en,us
Google Play,2b69ca28-c55e-4c67-86f7-2ab5f7e8ed64,A Google user,,It's the best budgeting app I've been able to find. Most intuitive software and it's easy to navigate and edit. Very impressed and very pleased!,5,1,2019-03-27 22:53:52,,,3.9.3,en,us
Google Play,b482767c-42be-4328-8a1d-987424efcca7,A Google user,,great app!,5,0,2019-03-25 11:53:05,,,3.9.3,en,us
Google Play,00d8f460-5def-4311-8a8b-babf13d0f68b,A Google user,,This app is really easy to use and clean. There is a paid option which I may go for soon that includes a digit/accorns type saving functionality. However I cant commit to it until those features have been added. super excited for their arrival!,5,2,2019-03-24 20:52:22,,,3.9.3,en,us
Google Play,c3c32f7e-184e-467f-9e50-fee97b8e281b,A Google user,,"overall a great experience. i recommend it to all my friends. the budget feature is a little half baked. i wish you could get alerts throughout the month with set benchmarks (i.e. 50% of your gas budget has been reached, etc). otherwise it's a pretty useless feature.",4,1,2019-03-23 00:42:35,,,3.9.3,en,us
Google Play,db7d2d24-fd92-4bfa-bfd5-12c4cf842bb8,A Google user,,so far as expected,5,0,2019-03-22 16:45:01,,,3.9.3,en,us
Google Play,ff0dfd73-7b34-4871-b03f-85e957776fd1,A Google user,,"LOVE THIS APP! I downloaded a lot of different budgeting apps, but this was, by far, the winner. It connected seamlessly to my bank and allowed for very easy modification of debit entries. I also like that it can ""remember"" how you want a type or merchant transaction classified as. There is some manual modification, based on my spending patterns, but I really don't mind.",5,5,2019-03-21 22:59:18,,,3.9.3,en,us
Google Play,769e76e4-c9a5-4502-a57f-e37c352fea36,A Google user,,"When setting up a reoccurring bill from a transaction, it will automatically select ALL transactions from that payee as a reoccurring bill. Edit: having to unmark every transaction that isn't the actual monthly bill is a ridiculous work around for the app automatically making every single transaction from a payee a reoccurring bill. When I select a transaction to make it a reoccurring bill, I want THAT transaction and ONLY that transaction.",2,4,2019-03-21 16:41:01,"Hello Derek. I’m sorry for not making it clear enough.

Here’s how to make the app work the way you want:
1. Say, there are 10 charges from “Amazon”, 3 of which are recurring bill payments;
2. Rename those 3 charges to “Amazon bill” and leave the rest as “Amazon”;
3. Mark “Amazon bill” charges as a recurring bill.

Hope this helps, 
Stan.",2019-03-21 18:16:33,3.9.3,en,us
Google Play,8c82e6c8-e87e-416e-9bd8-5db327351814,A Google user,,great except it disconnects from my bank from time to time,4,0,2019-03-19 15:11:56,Hi Dean! Could you please try to validate your credentials and then try to refresh your accounts? Please contact us at support@pocketguard.com and our support representative will assist further.,2019-03-20 13:51:44,3.9.3,en,us
Google Play,950b1041-c547-4bf1-bd41-6482d0eb3932,A Google user,,"it would be great to be able to split some expenses into different categories. And one more, important. When you change smth for all transactions you can't undo it after that. You should warn a person about it with the question like ""Are you sure? You can't undo it!"". For now, you can tap it accidentally and it runs without any warning.",4,3,2019-03-17 20:08:24,,,3.9.3,en,us
Google Play,c326a7ee-02a8-4e7e-8490-45cd11700434,A Google user,,"I've been looking for a good cash flow budget app for years! Most budget apps don't account for fixed bills, savings, and debt reduction goals. Instead, they say you have a ton of money ""left in budget"" when actually your landlord hasn't deposited your rent check. This calculates that and lets you know how much you ACTUALLY have available for groceries, entertainment, etc. It's a little spammy with suggested partners, but other than that a solid tool.",5,6,2019-03-16 22:47:59,,,3.9.3,en,us
Google Play,f7969782-7d75-4ec6-8fea-b63adb6f96d6,A Google user,,"easy to use, easy to see details of spending",5,0,2019-03-12 17:51:30,,,3.9.3,en,us
Google Play,36379ed4-98ff-44a6-8c04-e9f2ccdee4e5,A Google user,,great app! keeps up with all my bills!,5,0,2019-03-12 11:24:59,,,3.9.3,en,us
Google Play,248a6d73-161f-4cf8-a5e3-bdb106059eb1,A Google user,,Excellent for student budgeting,5,0,2019-03-11 14:01:48,,,3.9.3,en,us
Google Play,b909a580-27fe-42a0-a584-8d53dc1f6ee6,A Google user,,"They negotiated dome of my bills and got a lower monthly payment!! Plus, it was a real eye opener seeing how much I was spending in some categories!!!",5,0,2019-03-10 14:16:14,,,3.9.3,en,us
Google Play,92c082a9-e4fb-481d-8531-3aeb3cb7b53f,A Google user,,"This app has helped keep everything in check. I can see how much has been spent in a budget category easily, so I know whether I can spend freely or more restricted before I shop.",5,1,2019-03-09 13:23:02,,,3.9.3,en,us
