source,review_id,user_name,review_title,review_description,rating,thumbs_up,review_date,developer_response,developer_response_date,appVersion,language_code,country_code
Google Play,5740419f-4463-40d1-b7da-8fcc67b36c60,A Google user,,Looks good and gives me all info I need,5,3,2018-08-20 14:43:31,,,3.7.4-legacy,en,us
Google Play,cb89179a-58d1-4636-936c-aa80cbf4f26d,A Google user,,"I can assure you that this app is best money tracker out there. It does a 
great job categorizing my trasnactions and updating my accounts every day",5,4,2018-08-19 19:35:37,,,3.7.4-legacy,en,us
Google Play,4c26ce3d-9263-4945-b0b3-988bf94c5040,A Google user,,Best hands down budgeting app,5,0,2018-08-19 13:49:51,,,3.7.4-legacy,en,us
Google Play,3c322805-d395-4a03-b7a2-b044fb8429b2,A Google user,,Provided me with all the features I need. Really like this app.,5,2,2018-08-19 09:42:24,,,3.7.4-legacy,en,us
Google Play,93f7cee6-6d1b-44de-8baf-5221dc262e94,A Google user,,Add support for Robinhood and the app will be perfect,5,1,2018-08-19 08:21:37,,,3.7.4-legacy,en,us
Google Play,43e8eac5-1883-41c0-8920-76ccd233adf0,A Google user,,"Pocketguard allows to connect any kind of financial accounts and that's 
what I like about it. Great app!",5,0,2018-08-19 07:20:45,,,3.7.4-legacy,en,us
Google Play,2d27af47-8fe8-4f84-9cc0-b13bc84e1da9,A Google user,,"I always wanted to start budgeting but never had enough patience to finish 
the set up. But in Pocketguard it took me just 5 minutes to connect 
accounts and set bills. Now I'm visitng this app regularly to check my 
expenses and it already helped to me to spend less",4,4,2018-08-18 17:04:32,,,3.7.4-legacy,en,us
Google Play,a8f4d488-fae2-48b6-8812-42437c321f16,A Google user,,"Account connection took a bit longer than I thought but everything else 
works great so far",5,1,2018-08-18 16:14:03,,,3.7.4-legacy,en,us
Google Play,07cbe655-48fe-4bcc-800a-9b056b7a9756,A Google user,,"I prefer PocketGuard to other spending trackers because of its awesome 
layout and amazing features. In my pocket helps me stay within the budget 
for 5 months in a row!",5,1,2018-08-18 16:10:24,,,,en,us
Google Play,0b0e2ee0-41c3-4e3c-a833-ee2c0fc10ac6,A Google user,,It's sooo coool,5,3,2018-08-18 09:41:34,,,3.7.4-legacy,en,us
Google Play,51dee8f5-105a-486a-b5a7-e7807e3f9eec,A Google user,,"This app fits me perfectly. It tracks my income and bills, calculates how 
much money I have to spent and shows financial breakdown. That's all I need 
to be on top of my finances",5,3,2018-08-18 04:10:57,,,3.7.4-legacy,en,us
Google Play,c8b4f3a3-a139-4fc7-94b8-0e74a2c32e27,A Google user,,Very intuitive app. Love its spending pie-chart feature,5,2,2018-08-18 03:29:35,,,3.7.4-legacy,en,us
Google Play,06493ff1-a19b-4743-a723-6c984fc759e0,A Google user,,Recommend it to everyone,5,4,2018-08-18 03:09:21,,,,en,us
Google Play,8e8b5ded-ff9e-4c34-a485-880994e96ca2,A Google user,,"Love the dark layout. I've been using this app for half a year now and 
totally satisfied with it",5,5,2018-08-17 17:23:04,,,,en,us
Google Play,7c5a4b2c-59e6-49a5-bfd6-cd5b7eca6497,A Google user,,Pocket guard helped me to start budgeting and solving my financial problems,5,3,2018-08-17 16:39:05,,,,en,us
Google Play,858e233c-453c-4102-8c0b-7dd0ee33a644,A Google user,,Amazing tool to organize your finance and keep them in order,5,1,2018-08-17 09:40:20,,,3.7.4-legacy,en,us
Google Play,97023633-9f1e-412d-a286-7e2bb1aaadfa,A Google user,,"With PocketGuard it takes me less then a minute to check up on all my 
accounts",5,2,2018-08-17 05:19:26,,,3.7.4-legacy,en,us
Google Play,e6ef7b15-df29-4d64-a857-d3b9248d4c38,A Google user,,"I just started using this app recently and hope it will help me to save 
enough to have a splendid wedding this summer. So far everything goes 
smooth and I managed to reach my savings goal in Feb… Yay! 😄",5,4,2018-08-14 04:52:01,,,3.7.4-legacy,en,us
Google Play,b5951dbd-2ec1-4ee7-9d5c-0d3034928613,A Google user,,"Outstanding app. Shows all the purchases from different banks in one place. 
If you never tried an automatic budgeting before, I'd recommend you this 
one, it's very convenient and easy to use.",5,1,2018-08-14 04:46:40,,,3.7.4-legacy,en,us
Google Play,6d5b8278-f1a4-4401-9a38-5e4a115c931d,A Google user,,"PocketGuard changed my mind about budgeting. I never thought that managing 
your finances can be so easy",5,3,2018-08-08 23:04:53,,,3.7.4-legacy,en,us
Google Play,e36ac021-748d-4fa4-b39f-cf5eac4bccff,A Google user,,Recommend Pocketguard to everyone who cares about their money,5,4,2018-08-08 21:50:42,,,3.7.4-legacy,en,us
Google Play,c5a4e1cd-df74-40cd-b200-d523fe2c1661,A Google user,,"Like that it calculates the spendable amount for me. I'm trying to follow 
it and it works great so far.",5,4,2018-08-08 00:22:49,,,3.7.4-legacy,en,us
Google Play,34a9dd82-d465-43cf-8c63-ca17061c9083,A Google user,,Pocketguard is definitely a good choice for budgeting and money tracking,5,8,2018-08-05 10:36:39,,,,en,us
Google Play,a3bf7b6a-13f9-4d1d-8ee9-709f13875268,A Google user,,"Not glitchy, free and great UI",5,9,2018-08-03 00:33:04,,,,en,us
Google Play,385ba83c-f0eb-4fe3-9228-b05513ba1163,A Google user,,"I don't budget on a monthly basis. I budget bi-weekly which. My budget goes 
into the next month. I didn't see an option to budget the way I need to. 
This app didn't work for me for that reason alone.",2,2,2018-07-28 08:03:50,,,3.8.4,en,us
Google Play,ff12f3d9-eddc-4dc8-b47b-e561fa742fe3,A Google user,,this app lets me know when I've been hit with a fee,5,1,2018-07-25 18:07:29,,,3.8.3,en,us
Google Play,73cb9140-0004-444a-9de5-f7bb41bc7389,A Google user,,"Epic! Great app for budgeting, money tracking and saving up",5,0,2018-07-25 15:01:13,,,3.7.4-legacy,en,us
Google Play,f936cc6b-0277-48bf-bacd-da7e7f6a09b1,A Google user,,"Like that PocketGuard's autofilling transactions into categories and 
calculates the spendable money for you. Love it.",5,0,2018-07-22 11:29:34,,,3.7.4-legacy,en,us
Google Play,07f0d069-5e97-411e-bbb3-58ad7054e3a0,A Google user,,Exactly what I needed. I really hope they add custom pockets though.,4,0,2018-07-21 23:34:00,,,3.8.3,en,us
Google Play,a5b71e01-ee45-4535-a854-31cf24e800ff,A Google user,,Most intuitive and full-fledged money management apps I've ever used. Great!,4,0,2018-07-21 21:39:24,,,3.7.4-legacy,en,us
Google Play,715259ef-dc41-4ddb-8938-254bdfddc178,A Google user,,"Its great to visualize your financial life. Even if you think you're good 
with money, this app can be very eye opening.",5,0,2018-07-21 18:15:56,,,3.7.4-legacy,en,us
Google Play,03fac0c9-ce7f-4d0d-9882-4e05c6c37323,A Google user,,"Very handy tool to track your spendings, especially if you have several 
accounts in different banks",5,2,2018-07-14 14:30:57,,,3.7.4-legacy,en,us
Google Play,c077c1fd-4844-43d5-8d4d-34df5fe0f26a,A Google user,,Pocketguard helped me to start saving up,5,1,2018-07-14 11:25:41,,,3.7.4-legacy,en,us
Google Play,7818047c-745e-490b-b918-5f3b3ec80a4a,A Google user,,Best means of tracking all of finances right in the palm of one's hand.,5,2,2018-07-13 14:59:15,,,3.7.4-legacy,en,us
Google Play,7f9c2b87-38d5-4bb7-8cd0-b7655fc1c851,A Google user,,"Very accurate spending tracker with auto categorization, also like the 
financial breakdown it provides",5,1,2018-07-13 14:52:41,,,3.7.4-legacy,en,us
Google Play,abc83c24-9602-45d9-a1ce-9326dabbce65,A Google user,,"Great app and website, I use them both all the time. Really helps to 
control my finances",5,2,2018-07-12 15:00:45,,,3.7.4-legacy,en,us
Google Play,b13111b4-71eb-4b7f-9e5e-a611b8f05db2,A Google user,,"Its great to have my transactions split up into various purchase categories 
and that I can adjust them if something goes in a different category. Also 
love the pie-chart option, it made me find out some of my spending habits 
that I never noticed before.",5,7,2018-07-12 13:47:57,,,3.7.4-legacy,en,us
Google Play,e980c3d2-db79-4157-b616-7e9130ccedc6,A Google user,,Just what I needed to organize my finances. Brilliant app,4,1,2018-07-12 12:28:11,,,3.7.4-legacy,en,us
Google Play,20237be9-37fe-4c16-be84-7301d1e9ec74,A Google user,,"If it wasn't so slow, it might be a nice app. What ""shouldn't take more 
than a minute..."" was taking 10. I dont have time to set up each of my 
accounts at 10 mins a piece. Would love to love it but never made it past 
my 1st account setup.",1,0,2018-07-08 20:28:13,"Hi Raychelle, thanks for letting us know about this issue. It's an irregular behaviour of PocketGuard app and we will do our best to investigate the case and fix it ASAP. We are sorry for the troubles caused.",2018-07-10 06:53:05,3.8.2,en,us
Google Play,c3365f97-5c55-4325-bc9b-a8776815da72,A Google user,,"App was not what I was looking for. Canceled subscription and uninstalled 
but still being charged!",1,0,2018-07-05 04:14:46,"Hi, Nicole! Your subscription is successfully canceled as of July 5, 2018, and you will not be charged a penny anymore. We are sorry for any inconveniences. Please contact us at support@pocketguard.com if you have any questions.",2018-07-05 10:38:36,,en,us
Google Play,967b07d3-11d4-43f2-9fdd-cad994e1aa56,A Google user,,Now I'm saving my money thanks pocketguard,5,4,2018-06-24 13:09:07,,,3.8.1,en,us
Google Play,eb99fb86-acb5-4013-9b28-15a5b4e111af,A Google user,,"Does not add various know financial entities as PayPal, needed to sync 
absolutely everything to be useful, otherwise it defends the purpose having 
to check more than one place for totals",1,0,2018-06-21 04:25:42,"Hi Christian! Unfortunately, at the moment Paypal Prepaid Mastercard doesn't allow our data aggregation partners to aggregate their accounts properly. Our data aggregation partner's engineers are currently working with this institution to allow their customers to aggregate. We are really sorry for the inconvenience.",2018-06-21 17:01:18,,en,us
Google Play,a4eaa332-3662-4084-82a2-6ea990ae4b39,A Google user,,"It initial setup was rather painful and incomplete. It wouldn't let me add 
my loans (Great Lakes) or phone bill (Project Fi) as part of the accounts 
section. It'd be much better having bills selected via a connected account 
instead of having to select transactions from your billing history. Every 
bill is slightly different in cost, after all.",3,0,2018-06-19 17:49:37,"Hi Jonathan! Please contact us at support@pocketguard.com so that we could investigate the issue with connecting Great Lakes for you. So far our data aggregation partner supports only monetary accounts (i.e. checking, savings, investment) but they are currently investigating options to support billed services like Project Fi.",2018-06-20 11:38:50,3.8.1,en,us
Google Play,ef5cbcf7-a551-41e7-a3ef-183f4572b65c,A Google user,,"I like the app and how I can organize into categories. Some of it is harder 
to understand at first. I wish I could change the dates on the transactions 
because I receive rent money from others before I pay rent so it doesn't 
reflect what is actually in my pocket. I can't rely on the app to actually 
see what I have in my account. I used to use Penny and loved it for a quick 
glance and budgeting. This one is better for tracking overtime. Still got 
to log into my account for daily glances :/",4,3,2018-06-15 01:55:43,,,3.8.0,en,us
Google Play,b7745544-caa5-40a3-abb3-982696a750da,A Google user,,"Nothing simple about it. After importing tons of info, and marking income 
and bills, the app doesn't recognize new transactions properly and doesn't 
count them towards the correct categories. When I try to correct the errors 
it just deletes the category altogether and I have to set it up all over 
again. What's the point of trying to track stuff if I could do it easier on 
paper?",1,0,2018-06-15 01:07:12,Hi Dan! We are currently rolling over a new categorization algorithm. Please contact us at support@pocketguard.com so that we could investigate the issue and put all our efforts to resolve it as soon as possible. We are looking forward to hearing from you. Thanks.,2018-06-15 10:05:56,3.8.1,en,us
Google Play,687b17c1-83be-4e6c-8bd0-d4117ff84b54,A Google user,,Weeeeee,3,0,2018-06-13 21:39:12,,,,en,us
Google Play,c97db32e-5b85-4100-9cd8-54509de6cfc2,A Google user,,Absolutely loved how easy to use this app is,5,0,2018-06-12 23:25:15,,,3.8.0,en,us
Google Play,d5e1b54a-ed3c-452a-933a-d816fd07f244,A Google user,,"I looked into a lot of other better looking financial budgeting apps before 
downloading PocketGuard. I was searching for an app with two basic 
functionalities but PocketGuard seemed to be the only app that could 
deliver. 1. Account synching so all of my purchases are on the app. 2. The 
ability to tag and categorize transactions. PocketGuard allows me to do the 
bucket budget method. There are some minor peculiarities like getting 
emails that say my accounts are not snyced when they are but I've been very 
pleased with it's functionality.",5,0,2018-06-10 14:32:55,,,3.7.1,en,us
Google Play,ef32a9ab-7f60-4616-a069-0324f54ff464,A Google user,,"Doesn't work unless you have a US bank account that you can link with the 
app.",1,1,2018-06-05 19:42:14,,,3.8.0,en,us
Google Play,9a0c6361-0caa-4d9e-bb03-7905e1dcd92a,A Google user,,Just wish I had a premium one time payment option. The app itself is great,4,2,2018-06-02 05:27:25,,,3.8.0,en,us
Google Play,7b311c00-d1d0-4de5-90f5-09c8e21f2ae0,A Google user,,"This app was exactly what I needed to get a handle on my budget. It synced 
up with my bank account and gave me a detailed overview of where my money 
was being spent. It also let me set spending limits which really helped get 
my family's spending under control.",5,0,2018-06-01 12:54:43,,,3.7.10,en,us
Google Play,7e51cc1a-3081-4ed1-ae97-faa25b0aec9d,A Google user,,"Like this app better than mint and clarity, but wish it showed credit card 
limits, apr's, minimum payments and due dates like mint. Still better than 
the others! Sometimes accounts go out of sync and it's a pain to re sync 
them some accounts it happens frequently but again, they aren't perfect but 
much better than the other apps I've used! Helps me and my husband track 
all our spending across multiple accounts since combining ie money. Also 
helpful in keeping track of paying off debt, good recommendations too!",5,1,2018-05-31 15:51:13,"Hi Christine, we are so glad that PocketGuard is helpful to your family! As for the due date, APR, and other card info, In case your bank didn't provide us with it, you can tap a card on Accounts tab and add it manually. 
If you have any questions or issues, don't hesitate to contact us at support@pocketguard.com",2018-05-31 08:43:02,3.7.10,en,us
Google Play,f3701f01-5aef-4d2f-8583-654653a05656,A Google user,,"I thought I was going to like it, but after initial set up you have to 
upgrade to add a bill manually. That's irritating. Probably going to delete.",3,0,2018-05-30 15:59:28,"Hi Danielle! PocketGuard is a free automatic budgeting app, so you don't need to pay a penny to add a Bill that is posted to one of your accounts. And if you want to add a cash bill, this option is available on Plus plan only. With any questions, please contact us at support@pocketguard.com",2018-05-31 12:58:04,3.7.10,en,us
Google Play,ca70aa08-b837-4aa1-9f6e-3405030c0b07,A Google user,,"Everything is great so far. One of the few, at this moment, expense apps 
that fully supports my bank and credit card company. I appreciate all of 
the customization for the charges. I only wish the UI was a bit more 
attractive. The insights menu would be nice if it had the expense value on 
the graphic as well as a percentage.",5,3,2018-05-18 00:14:18,,,3.7.10,en,us
Google Play,19c8dc4b-a603-4bc9-ac1b-21deb996e766,A Google user,,"It has a slick design, but calculates income incorrectly. The app is also 
always a day or two behind when calculating your daily budget. However, it 
is good for a monthly review.",3,0,2018-05-11 11:06:09,"Hi Danielle, thanks for the review. As you know, ""In My Pocket"" includes the ongoing spendings which are pulled from your accounts automatically. Some banks don't allow us to pull transactions in real time, that's why you might see the delay. As for income, please contact us at support@pocketguard.com and we'll try to solve the issue for you.",2018-05-31 07:56:41,3.7.10,en,us
Google Play,c68d11ee-7b1f-4698-a0bd-c67439caab04,A Google user,,"Was not able to link any of my accounts. Normally I would just uninstall 
apps like this, except apparently the people who run this app _really_ want 
engagement. I got at least 3 emails and around 10 notifications from this 
PoS before I finally got rid of it. Avoid at all costs, or at least sign up 
with a fake email and disable notifications",1,0,2018-05-07 14:35:51,"Hi Joseph. Please accept our apologies for the inconveniences. As I can see from our records, you had an aggregation error due to a temporary glitch on our data provider's end. If you try connecting the accounts again, the attempt should be successful. Besides, you can turn off notifications in Settings and unsubscribe from our emails.",2018-05-08 06:35:04,,en,us
Google Play,70765102-29c1-4b73-92f0-43f9267b6219,A Google user,,"I was worried about security at first but still gave it a try and haven't 
had any regrets on this decision ever since. Great app!",5,0,2018-04-23 15:45:22,,,3.7.4-legacy,en,us
Google Play,53275034-e9a7-43f0-822b-c8124df6f805,A Google user,,"Had trouble deciding what budget app to download. Glad I chose this one. I 
wanted something that was generally simple and easy to use and this fits 
the ticket. Also really glad it's not covered in ads or other monetization. 
Good stuff!",5,1,2018-04-23 13:51:56,,,3.7.9,en,us
Google Play,f8b2a602-55b1-4034-8a67-cc84ab4b5512,A Google user,,"I find this app to be very helpful for my family budgeting. We used to 
budget in excel doc but now don't have time for that and Pocket Guard is so 
much help for us.",5,2,2018-04-22 14:27:59,,,3.7.4-legacy,en,us
Google Play,436ba67f-de29-46ad-8923-8b95bb4b0a7c,A Google user,,"You know, the first step to getting rid of bad habits is to aknowledge them 
and that's what PocketGuard is necessary for: it shows all the bad 
financial decisions you've been making so that you could finally stop the 
unnecessary spening. It really helped me to be more careful with money and 
finally start saving.",5,4,2018-04-22 13:24:35,,,3.7.4-legacy,en,us
Google Play,e5bc1c20-d2be-4654-8452-d284677de8e4,A Google user,,Helped me see how much money was spent on fast food and other junk.,5,3,2018-04-22 06:27:58,,,,en,us
Google Play,2c8bc021-f708-4b75-8f73-3d2d1a7fd92d,A Google user,,"Hope PocketGuard website will get all the missing features soon. Really 
like it!",5,3,2018-04-21 15:51:28,,,3.7.4-legacy,en,us
Google Play,c7d15da1-1542-46fa-a445-f9ea6b84c2bb,A Google user,,Glad I gave this app a shot. It does help me to avoid overspending.,5,3,2018-04-21 09:27:40,,,3.7.4-legacy,en,us
Google Play,8145195e-6b2f-440f-802f-02ca2639d5f7,A Google user,,"I feel really lucky to find this app. Unlike other budgeting apps that I've 
been using, Pocketguard I really enjoy. I think, that's what makes the 
daily routine of budgeting so easy now, even though I have to pay for using 
cash account.",5,1,2018-04-20 07:26:00,,,3.7.4-legacy,en,us
Google Play,222b8973-85aa-47b3-b758-62db4ce8f98c,A Google user,,"Set up is really easy in here: just connect your accounts and the app finds 
your bills/income automatically for you. It look me 5 minutes to finish the 
setup and get going. The only con was asking for too much of my personal 
info, but I just skipped this step. I would 100% recommend this app",5,1,2018-04-20 05:22:03,,,3.7.4-legacy,en,us
Google Play,02898a27-ce9c-4134-9a67-20a36518ab28,A Google user,,"I needed something simple and easy to use that I could connect my accounts 
to and have my trasnactions catgeorized and analyzed for me. That's exactly 
what Pocket Guard is doing",5,1,2018-04-18 14:56:29,,,3.7.4-legacy,en,us
Google Play,b696eaa3-5c7b-481d-904f-f41f3bf0a952,A Google user,,Incredible! Love the dark style and great usability,5,3,2018-04-17 13:31:47,,,3.7.4-legacy,en,us
Google Play,c3b94af6-a645-4695-ab55-0a5ee4b4fb9d,A Google user,,This app is great for monitoring your expenses transaction by transaction. Besides it creates a budget based on the trasnactions that you can stick to if you want. Great app but fits only people with regular stable income,5,3,2018-04-12 15:22:52,,,3.7.4-legacy,en,us
Google Play,bb488808-f21c-4791-a36c-f426446c5926,A Google user,,It was hard to control several accounts at different banks till I found this app,5,0,2018-04-12 05:51:03,,,3.7.4-legacy,en,us
Google Play,27bfee7f-ee52-49eb-be0f-8da2c6231a66,A Google user,,"Now when there're apps like Pocket Guard out there, pleople have no exuses 
for not tracking their finance. Honestly, it's so easy!",5,0,2018-04-10 06:07:42,,,3.7.4-legacy,en,us
Google Play,273bdbc7-ecb9-4a46-86dc-2e87c7eba668,A Google user,,"As for a free tool, it's just WOW!!",5,0,2018-04-09 16:10:37,,,3.7.4-legacy,en,us
Google Play,2dd44969-fa17-4759-9f3a-2d58f2937443,A Google user,,"I've struggled with budgeting apps and solutions in the past, mostly because of how all over the place my financial stability has been over the years. I wish I had found PocketGuard earlier, but glad that I have it now.   Being able to simply see what I have spent over the course of a month, two months, etc. allows me to make realistic budget choices that are based on my actual lifestyle. Using hashtagging, I was able to narrow down #coffee and realized I spend about ~80$ on it. Now I know I can probably cut that in half and look back at my Pocket Guard to see if I'm staying on my Mark. I love the ""pockets"" for categorization and this app has truly helped me have a better understanding of what I spend my money on.",5,12,2018-04-08 13:23:33,,,3.7.8,en,us
Google Play,caeadce0-0112-45d5-8338-df6a4ec050b6,A Google user,,Absolutely the best money management app I have found! I've tried a few and this one is the best. You can make it as simple it as detailed as you want.,5,2,2018-04-07 23:39:12,,,3.7.8,en,us
Google Play,836b7355-a2b0-40d3-9167-af414ed23557,A Google user,,"I've never been good with money, and this app puts everything in one place, even taking into account my Venmo and PayPal accounts! And it's easy to check, so I end up catching unexpected charges or subscriptions I forgot to cancel.",5,7,2018-04-07 16:08:17,,,3.7.8,en,us
Google Play,d1638d84-98cd-448f-80a4-ec85c48666f8,A Google user,,Lots of useful information. A great and better alternative to ClarityMoney,5,0,2018-04-06 08:40:30,,,3.7.4-legacy,en,us
Google Play,b37e6e4d-f4f6-42c2-a4ca-ec0b082fcdaa,A Google user,,I left the app about a year ago as I need to track not only the money on my bank accounts but also cash. And now I'm happy to be back! Pocketguard is the best combination of automatic and manual tools for me,5,0,2018-04-05 15:37:24,,,,en,us
Google Play,13efa929-2954-4360-9d7f-d1c6296d6d07,A Google user,,Even my teenage son is now using this app on his own will. Can you imagine? A teenager! This app really attracts with its simplicity and design.,5,1,2018-04-05 14:45:40,,,3.7.4-legacy,en,us
Google Play,f0801848-9855-47f8-bdba-92c8c79b418e,A Google user,,"I have 12 investment accounts in different banks and it was a real headache to track all of them before I found Pocketguard. Thanks you for the app, guys.",5,2,2018-04-04 04:35:52,,,3.7.4-legacy,en,us
Google Play,ca2a26c3-8f34-4a42-92de-3d2a8ffa52bc,A Google user,,Best automatic budgeting app!!,5,2,2018-04-04 01:37:09,,,3.7.4-legacy,en,us
Google Play,7a295554-3421-4dbb-9d46-516e4ceeb421,A Google user,,Truly helps manage your finance. I feel a little bit at ease already having enough transparency on what I'm spending. Everyone should give this a try!,5,1,2018-04-03 15:34:06,,,3.7.4-legacy,en,us
Google Play,435a8f40-2873-4876-99df-f702bf893c68,A Google user,,"I feel more comfortable when I know how much money I have left ""in my pocket"", so I know where I should stop spending. Pretty great.",5,0,2018-04-03 06:11:20,,,3.7.4-legacy,en,us
Google Play,252dc2e3-4186-48ab-a642-06b39e0db5f9,A Google user,,Installed it several months ago and now I'm free from any budgeting trouble.,5,0,2018-04-03 05:39:19,,,3.7.4-legacy,en,us
Google Play,e6ce0547-89e0-4857-824a-b2c60981f1b4,A Google user,,Finally an easy to use budgeting application,5,0,2018-04-02 12:28:08,,,3.7.4-legacy,en,us
Google Play,8383323d-8368-4a3b-8ff8-aef53f14f82d,A Google user,,"Any new devices l get, this is the first thing to get downloaded.",5,0,2018-03-31 08:58:06,,,3.7.4-legacy,en,us
Google Play,12362f98-d8be-47ee-9107-f0f873b5809b,A Google user,,Hands down budgting app. Just what I was looking for,5,1,2018-03-31 07:49:01,,,3.7.4-legacy,en,us
Google Play,a4693a43-91e1-4321-85da-43bcd144e8ed,A Google user,,"Simple interface that allows me to set my budget at the beginning of the month, track expenses, and see my balance.",5,0,2018-03-31 04:41:13,,,3.7.4-legacy,en,us
Google Play,bb534ed9-3496-42b8-8569-0111e1bdf68c,A Google user,,I’m a very visual person and the layout of this app is so enjoying. Features are very useful too.,5,1,2018-03-31 03:14:59,,,3.7.4-legacy,en,us
Google Play,b6056c9b-5a0d-43f4-a6b9-b9fc18f10a71,A Google user,,I wish you could edit the names of accounts.,5,0,2018-03-30 04:11:44,,,3.7.4-legacy,en,us
Google Play,4e59490e-7912-4592-a89f-15f2ccf256e8,A Google user,,This app is all around awesome.,5,0,2018-03-28 15:53:33,,,3.7.4-legacy,en,us
Google Play,c5fb1899-3fcb-48ce-b593-57b051f26dd8,A Google user,,I love the information all centralized in over location. Customer service fixed my issue quickly. Highly recommended by my financial advisor. Wish I started using this app years ago.,5,2,2018-03-28 06:11:20,,,3.7.7,en,us
Google Play,4e6e2773-abee-4bcf-aa5d-26d06e703bc3,A Google user,,When will the Net worth will be added to the web app? I really miss it when using web,5,1,2018-03-28 04:13:18,,,3.7.4-legacy,en,us
