source,review_id,user_name,review_title,review_description,rating,thumbs_up,review_date,developer_response,developer_response_date,appVersion,language_code,country_code
Google Play,2c0452bb-8582-46eb-bd7c-e3f0f27967c0,GlassHalfPhil,,"This is the first budgeting app to successfully connect with my credit union app. So glad I can start automating my budgets. Also love the ""do not include in calculations"" button for each transaction. We use a credit card for all our purchases (points, baby!) and counting every purchase and every credit card payment would make it look like we're spending 2x as much as we are.",5,5,2021-02-18 22:10:41,"Hi there! Thanks for your love. If you have any questions, please contact us at support@pocketguard.com.",2021-02-23 12:02:52,4.12,en,us
Google Play,bcf9a6ef-4009-484e-98fa-72784e74f6b9,Daniel Nehring,,"Great overall application, I do think the user experience around budget vs upcoming bills could be improved but this is an incredibly useful app.",5,0,2021-02-17 20:49:51,Hi Daniel! We've forwarded your feedback to our developers. Thank you for taking out the time to send us your suggestions!,2021-02-18 12:22:16,4.12,en,us
Google Play,1cf10c26-470a-4be9-96f4-5d3b9828f706,Alex Silvas,,"Everything is working out after a solid month of use. However, I would LOVE an easy way to pay off credit card debt. I have a lot and am using this app to budget, so it would be great if it could track my progress and maybe predict a paid off date. That's the only reason this isn't a 5 star.",4,1,2021-02-17 17:23:21,"Hi Alex! Thanks for your feedback. We have already started working on the ""Debt pay off"" feature and will notify our customers once it would be available to use. Please, contact us at support@pockeguard.com in case you have any specific suggestions. Have a great day!",2021-02-18 12:27:32,4.12,en,us
Google Play,649118aa-0cee-472f-a706-82ebb5f06ad6,Alex Leslie,,"For only around $100 for a lifetime membership, PocketGuard is a steal compared to a lot of other budgeting apps. It's also very well suited to creating your own categories and adjusting the details of your purchases. Can't recommend enough!",5,2,2021-02-16 12:58:15,Hi Alex! Thanks for your feedback. We are glad you enjoy the app =),2021-02-18 12:30:16,4.12,en,us
Google Play,37eff72c-9239-4bcf-94d2-e3df32d4af34,Myriem Ksouri,,I love this app. It is easy to use and has all the functionality I need to manage my money. Wish I could give it more than 5 stars.,5,0,2021-02-15 19:11:18,Hi Myriem! Thank you so much for your review.,2021-02-18 12:28:00,4.12,en,us
Google Play,681a571d-443d-475a-aa0c-49e6b9044f9e,Rich Tomchuk,,"I want to like this app, I really do. The idea behind it and the interface are great. But the syncing is terrible. Some lag is understandable - banks for obvious security reasons don't update in real time. But the app will show a transaction in one screen, and then if I go to mark a bill Paid, it's not there. In My Pocket # will also mysteriously change even if there are no new transactions showing, then suddenly go back to the old number again. Makes it really hard to accurately keep a budget.",2,3,2021-02-14 13:15:15,"Hi Rich! Sorry for the inconvenience. PocketGuard requests an update from the financial institution every time you open the app, refresh your accounts, or during the overnight batch aggregation. If there are missing transactions, your IN MY POCKET would be incorrect. Please contact us at support@pocketguard.com if you believe this is the case.",2021-02-15 10:13:42,,en,us
Google Play,a0b36065-9851-4da6-a76b-e14113974255,A Google user,,"Best budgeting app out there in my opinion, when it works that is. More often then not, can't connect to my bank. Each time there's an issue with their data provider. You would think that they would switch to a different provider like Plaid, but maybe it's just Canadian banks that keep breaking.",1,0,2021-02-13 20:44:32,"Hi there! Sorry for the inconvenience. Please, contact us at support@pocketguard.com, so we could investigate your case and resolve it as soon as possible. Hope for your understanding.",2021-02-15 10:04:29,4.12,en,us
Google Play,47c07e38-812f-4503-9eef-ba2172d3fd84,Cyote atlodge,,"Extremely fast sync between bank and app, very easy to use👍",5,0,2021-02-06 15:02:30,Hi there! Thank you so much for your feedback.,2021-02-09 16:04:19,4.11,en,us
Google Play,39812e5f-ffa3-4704-88b0-cbb3bfe7d334,Micelle Emery,,"A little difficult to figure out (i.e. How to categorize purchases) - that part is not really intuitive. Otherwise a great app for people who have a couple of accounts and are looking to make a quick simple budget. For more complicated tracking, I'll be finding another app - it is too much work to set up all of my information just for the basic features and $4.99/mo is too steep for the amount of effort needed to set up a comprehensive budget.",4,9,2021-02-06 13:37:15,"Thank you for rating us!
Hope you will enjoy all features: bill organizer, debt payoff planner, budget planner, and bill tracker!
",2021-12-16 20:08:30,4.11,en,us
Google Play,51460cc2-8cbe-43b0-9725-3146941a9ab9,RedBearded T (SRN),,"Couldn't even begin using, I tried to add my bank, and it stops saying oops, something went wrong.",3,1,2021-02-06 07:48:10,Hi there! Sorry for the inconvenience. We were able to fix the issue. Please validate if everything works correctly on your end and let us know at support@pocketguard.com in case of any concerns.,2021-02-09 16:09:39,4.11,en,us
Google Play,d1633352-c45a-440d-b2d4-e703a14b2940,Irene Goodman,,"I love how easy it is to use, how it encompasses every account I have, and allows.memto check every account in one place.",5,0,2021-02-05 17:51:31,Hi Irene! Thank you so much for your review.,2021-02-09 16:05:07,4.11,en,us
Google Play,bb6fb89d-e5ac-4aef-b186-00e91b7d509d,leslie schaupmeyer,,"Amazing app! Despite it's short comings, it has helped me save and really attack my debt. I'd like to give it a 5 star rating, but there are a couple things that this app needs to fix. For some reason it hates one of my accounts and the total is incorrect.They tried to rectify it but it still shows a wrong total. Also, it needs an option to carry over certain budgets, month to month. Not everything is paid monthly but needs to be budgeted monthly.",3,7,2021-01-30 11:52:11,,,,en,us
Google Play,6c6cdc39-28a1-42f4-9225-ffea85e015e6,Matthew DeRoche,,"Not paying ridiculous cost for ""plus"" just to have normal functionality",1,1,2021-01-30 04:04:53,"Hey Matthew,
Now we add Track cash feature - so you can use our Budget App for free without connecting your accounts. You can connect your accounts later after you'll find Pocketguard useful.
Hope you will enjoy all features: bill organizer, debt payoff planner, budget planner, and bill tracker!
",2021-12-16 20:10:26,4.10,en,us
Google Play,8bf8ec92-37a1-4b0b-9049-e0bf8b003288,Sonja Kruzich,,It was great but now i cant access my account.,3,1,2021-01-30 02:16:52,Hi Sonja! Thank you very much for your feedback.,2021-01-29 15:54:45,4.10,en,us
Google Play,8574de7a-3a8c-4a9f-b9c5-7964192343d1,G LC,,"Good app but hasn't worked in two weeks, even though I'm a paying customer and haven't received a reply to my email describing the issue. Update: fixed",5,1,2021-01-29 15:57:20,"Hi there! Sorry for the inconvenience. The issue with missing transactions has been resolved recently. Please, double-check on your end and let us know and support@pocketguard.com",2021-01-29 15:54:19,4.10,en,us
Google Play,5b4995c5-b131-44c2-bada-18dabec63d9d,Tenza Burabura,,I'm having a great time! It's helping me think and plan my finances better!,5,0,2021-01-28 18:07:43,"Hi Javier! We are pleased that you enjoyed the app. If there is anything we can do for you, just let us know at support@pocketguard.com! Have a wonderful day!",2021-01-29 15:52:46,4.10,en,us
Google Play,47ba7dbe-f974-4953-a229-7a55edd9c8a2,Mike Dickinson,,Easy to set up and great tools for budget management.,4,1,2021-01-28 15:23:23,Hi Mike! Thank you for your comment. Is there something else that we could do to deserve a better rating from you? Let us know at support@pocketguard.com.,2021-01-29 15:53:04,4.10,en,us
Google Play,42c68e64-aa92-4ecb-a7c2-e816974029e1,Sue Fischer,,I like that I can get an overview of all my accounts whenever I want,5,0,2021-01-24 10:15:48,"Hi Sue! Thanks for your love. If you have any questions, please contact us at support@pocketguard.com.",2021-01-29 15:54:32,4.10,en,us
Google Play,b3da74cd-43e3-4cb1-a3ac-ee064d78c109,lucyandellagaming,,"App is great but when you have a problem and you reach out to support, they go from being prompt to being non-existent. Third email attempt from their ticketing system and even old emails to try to get a response but nothing. No ticket numbers or ability to followup. If they could be more responsive and have a proper ticketing system, would definitely rate it 4-5. Yes, I've checked my junk email, spam, etc. Tumbleweeds.",3,5,2021-01-22 01:51:00,"Hi there! We're so much sorry for the inconvenience caused. We have had temporary issues with our system. This is definitely, not a usual time of response. In case, you still have any concerns, please let us know at support@pocketguard.com. Hope for your understanding!",2021-01-29 15:57:03,4.10,en,us
Google Play,0942d5d5-4f82-48a3-aeb8-97202771432e,Sarah Campbell,,"I loved this app until recently. It hasnt updated my bank transactions in the last week. I know it has connected to my bank just fine, because it has my correct balance, but the last transaction it shows is on January 14th. I have about 20 transactions since then, none of which are pending. Please fix this. I have a paid subscription.",3,7,2021-01-22 00:30:24,"Hi Sarah! Sorry for the inconvenience. The issue has been resolved, recently. Please validate if everything works correctly on your end and let us know at support@pocketguard.com in case of any concerns. Have a wonderful day!",2021-01-29 15:58:08,4.10,en,us
Google Play,575775db-55eb-486c-ab63-b3f3a3e91d17,Colin Heckman,,I would rate this higher if support actually responded to my repeated messages about being unable to add additional accounts. I see other people get replies to their reviews. Is anyone ever going to get back to me?,1,2,2021-01-21 19:57:39,"Hi Colin! Sorry for the inconvenience. Unfortunately, Synchrony bank is blocking our attempts to sync your accounts. Please reach out to them and ask how you could allow aggregation for your accounts. Also, please email support@pocketguard.com and specify the name of the second financial institution you have a problem with. Have a great day!",2021-01-29 16:01:31,4.10,en,us
Google Play,a9890a7b-e2e2-44db-89ca-22ca51ab1518,Brandon,,Great app!,5,0,2021-01-20 15:45:36,Hi Brandon! Glad you like it! :),2021-01-29 16:02:53,4.10,en,us
Google Play,f020f863-95e5-415c-9c12-f336638911a4,David Gale,,"Always struggled budgeting until we got this app. Now its much easier for my wife and I to hold each other accountable for our spending and be aware of what's going on. Some aspects are a little clunky...I wish you could edit categories for pending transactions, and if I budget for a bill it seems to be double counting it in my ""cash available"".",5,6,2021-01-15 16:32:50,"Hi David! Thanks for your feedback. Pending transactions can be modified by your bank. This is why editing pending transactions is not allowed in PocketGuard. Please, contact us at support@pocketguard.com, so we could send you a workaround on how to edit bulk pending transactions and avoid double-counting. Have a good day!",2021-01-25 15:43:22,4.10,en,us
Google Play,c1c4f9c0-f5ba-4c7a-be7a-7e99e195c689,Tv Dun,,I used Mint for years before finding pocket guard. Mint had a habit of duplicating my transactions forcing me to fix their errors. I havent had that same problem with pocket guard. Its been simple. Transactions that are categorized wrong are easy to fix.,4,0,2021-01-15 12:09:22,"Many thanks!
Hope you will enjoy all features: bill organizer, debt payoff planner, budget planner, and bill tracker!
",2021-12-16 20:11:35,4.9,en,us
Google Play,acf39caf-e05c-4ee9-8d96-17b93eb106e6,Shaquana Dowling,,Good,5,0,2021-01-15 01:50:34,"Brilliant rate!
Hope you will enjoy all features: bill organizer, debt payoff planner, budget planner, and bill tracker!
",2021-12-16 20:12:05,4.10,en,us
Google Play,2b03ffdc-a707-471b-8995-7c3b9dc0cf17,Parshav,,Good features and pricing. Could use venmo integration,4,0,2021-01-14 22:47:55,Thank you for rating our Budget App!,2021-12-16 20:12:44,4.9,en,us
Google Play,8a2c72ac-97b8-4aef-852f-0b70da5edc84,Chris Mueller,,"Started using this app due to Simple closing. This is not a bank, so no separate account, but the budget features are a 90% replacement for what I liked about Simple. Main difference is no transfer of money into a budget envelope, only workaround is to change the budget amount, which is not nearly as elegant, and simple, as Simple. A negative is the slowness of picking up transactions from my bank, which means it is not safe to just glance at this app before spending money. Sync button doesn't.",4,7,2021-01-12 12:02:36,"Hi Chris! Sorry for the inconvenience. Our ability to collect your transaction information is sometimes limited by your bank. Some financial institutions will limit our access to transactions to once a day or less. Please, contact us at support@pocketguard.com, so we could send you the instructions on how to update your accounts manually.",2021-01-12 16:38:48,4.9,en,us
Google Play,0ea4df2e-3d42-4c62-b956-5532c5c8c39e,Ismael Rodriguez,,"Not enough access to all of my accounts. (No PayPal, no Varo Bank.) Income forecasting is ridiculous; assuming that my income is a set unchanging salary. It fluctuates with overtime, holidays, etc. It should work with what I've made and deposited, not an assumed set income amount.",1,1,2021-01-12 04:15:38,"Hi Ismael! Thank you for your feedback. I have already added your request regarding PayPal and Varo Bank. Once we reach a particular amount of customers, we would request our data aggregation provider to add the banks to the integration. Please, contact us at support@pocketguard.com, so we could help you to track recurring income. Have a great day!",2021-01-12 16:33:11,4.9,en,us
Google Play,33f6a002-c0da-4e10-8d68-c8cb598ae6a6,Travone Hall,,Super easy to use and extremely helpful for budgeting and planning.,5,1,2021-01-06 23:48:37,"Nice that you rate our budget planner!
Thanks!",2021-12-16 20:14:31,4.9,en,us
Google Play,364fe80b-6b01-4db7-b083-b7601c701a98,Scott Hylton,,I purchased the Plus version but cancelled it because ot didn't suit my needs. Customer service was helpful after a little delay in them getting back to me about a refund.,3,0,2021-01-05 18:49:04,Hi Scott! Sorry for the inconvenience. We still hope to win you back as a Plus customer and would be glad if you contact us at support@pocketguard.com and specify what can we do to make the app better for your needs. Hope for your understanding!,2021-01-06 17:47:09,4.8,en,us
Google Play,14543294-9225-4584-9ed6-b9a498d0ad03,Kristi W,,"I really enjoy this app I can customize it and I made several other categories such as door dash and Amazon, PayPal and those types of purchases go directly into there so I can see exactly what I Spend on top of the other given categories. I really enjoy this app and it broke down everything for me. In a really nice way That I could see months back and see good and bad spending trends of mine.",5,0,2021-01-05 05:11:53,"Hi Moskoto! Thanks for your love. If you have any questions, please contact us at support@pocketguard.com.",2021-01-06 17:45:31,4.9,en,us
Google Play,24294662-f940-4b4a-b38f-e57f20992cdb,joseph faulborn,,Helped me learn to budget,5,0,2021-01-03 17:42:35,Hi Joseph! Thank you very much for your feedback.,2021-01-06 17:44:40,4.8,en,us
Google Play,3407eab0-5377-47a4-b9c2-8bc0c4635f10,Nate,,This app was great until they limited view to 3 months in the past only. So lame.,3,0,2021-01-02 17:13:07,,,4.2.1,en,us
Google Play,8dd44d4e-f386-4253-b70e-82beed9bd2ed,Zack Smith,,Doesn't work properly with Lastpass and gave me errors when I tried to connect my bank accounts. Useless for me unfortunately.,1,0,2021-01-01 18:05:01,"Hi Zack! Unfortunately, our data aggregation provider doesn't support this financial institution at the moment. You could reach out to your bank and ask them to build an integration with Finicity.com - our data provider. We've seen a couple of success stories. Feel free to direct them to PocketGuard and we'll make the necessary introductions.",2021-01-06 17:43:38,,en,us
Google Play,2cedc363-827f-439c-a982-0fd4aaa647c5,The Disciple,,"Good App so far. Still a bit of a learning curve. Let's me know an approximate of what I have left to spend but not entirely accurate. The app would be great if it allowed you to separate monthly Amazon bills from Amazon purchases instead of categorizing all Amazon purchases as bills. However, I'm still learning the app and would recommend it.",4,4,2020-12-31 15:33:32,"Hi Anika! Thank you for your feedback. PocketGuard detects and matches transactions with bills based on the merchant name. Please, contact us at support@pocketguard.com, so we could send you the instructions on how to distinguish Amazon bills from purchases manually. Happy budgeting =)
",2021-01-06 17:41:08,4.9,en,us
Google Play,7f6b1649-310e-4606-a72b-065d40d7a16f,Betsy DeVries,,"This will not connect with 5 out of 6 of my financial institutions. When I contacted support they said it was user error, I was entering the wrong credentials. False, how are my credentials going to work online when I sign into my account and not here? There is a problem with this application. Again when I contacted support letting them know I had verified my credentials (I don't use a password manager, I actually know my account info) they came back with the same answer, my problem. Junk",1,2,2020-12-23 17:38:58,"Hi Betsy! Sorry for the inconvenience. Our data provider confirmed that your credentials for Discover Bank, indeed, were incorrect. Please, don't use saved/cached credentials and try to connect your bank once again. In case it didn't help, please send us an account summary screenshot at support@pocketguard.com, so that we could investigate further.",2020-12-25 08:32:50,4.8,en,us
Google Play,544b6560-23a9-4f10-83e4-ebeb03827432,Lamar Mincey,,I love this app,4,0,2020-12-21 02:14:18,"Thank you for your rate!
Hope you will enjoy all features: bill organizer, debt payoff planner, budget planner, and bill tracker!
",2021-12-16 20:15:30,4.8,en,us
Google Play,d31fcede-8b64-42cc-ada3-23d2dc124e45,Reina Bryant,,Great!!,5,0,2020-12-17 04:13:32,"Hey Reina,
Brilliant rate! Thank you!
Hope you will enjoy all features: bill organizer, debt payoff planner, budget planner, and bill tracker!
",2021-12-16 20:16:29,4.8,en,us
Google Play,60d17c7b-ed88-4ca0-bb6c-e84b8c62446e,Chris Dudley,,"Excellent budget app! Combines the flexibility of both zero-based budgeting and no budget approaches, bringing everything in a simple and clear way.",5,1,2020-12-16 05:25:17,Many thanks for rating our Budget App!,2021-12-16 20:17:09,4.8,en,us
Google Play,82f0a8f9-4cc6-4f32-8d5c-f7fcaebe6683,Jasper Jonson,,"Great so far. I would have given it a five except the transactions seem to lag behind and don't download into the program in a timely manner. I have the transactions through at the bank, but they won't show up on the app. Too much of a delay. UPDATE: I found out that my transactions were moving slower due to a merge. More importantly, I received immediate customer service directly, and they helped me to fix the issue. The service was immediate responsive and listened to my needs. That is why I moved from a 4 star to a 5.",5,11,2020-12-15 22:50:28,"Hi Jasper! Sorry for the inconvenience. Please send us a couple of examples of such missing transactions (account, date, amount, description) and a screenshot from your online banking displaying missing transactions at support@pocketguard.com. This would help us investigate the issue further and resolve it as soon as possible.",2020-12-15 14:51:54,4.8,en,us
Google Play,d1ce8c8e-1005-4c0e-bbab-1b7d91b3519e,matt de leeuw,,Excellent app helps out a lot for my budget.,5,0,2020-12-15 03:37:19,"Thank you for joining us!
Hope you will enjoy all features: bill organizer, debt payoff planner, budget planner, and bill tracker!
",2021-12-16 20:18:39,4.8,en,us
Google Play,6ec3197d-7998-45e1-b2b3-1e498aa99f34,Alicia Murray,,Continually losing features from the free version to try to get new to upgrade to the paid version. Very frustrating.,2,1,2020-12-14 00:09:42,"Hi Alicia! Thank you for your feedback. The free version has lots of amazing features that will help you to stay on track! The Plus plan is very helpful but not essential as it includes additional features only. Please, feel free to continue using PocketGuard on a Basic plan because it contains all the features needed for successful budgeting.",2020-12-14 13:31:56,4.8,en,us
Google Play,7decdb81-1136-4f99-9ccb-8ea7f13aa38b,Adam Atkison,,"Great app, really enjoy every feature!",5,0,2020-12-09 17:58:38,Thank you for joining our budget App!,2021-12-16 20:19:16,4.7.1,en,us
Google Play,5cf4cd1c-a14e-4d33-9c73-bc35a584dde8,Caleb Terry,,"Pocketgaurd makes it easy to budget, it's one of the few that auto-adds all of your transactions so you don't have to record every thing you buy. Would highly recommend, especially if you aren't great with money. One thing though, I wish I could edit my monthly budget without my changes carrying over to the next month. Sometimes I overspend on eating out, I'm fine adjusting my budget, but I don't want to plan to overspend every month. Let me fix my budget without changing next month's goals",5,16,2020-11-30 04:19:08,"Hi Caleb! Thank you for your feedback. Since the idea of the IN MY POCKET feature is to help our customers to spend less than they earn, even if you ""use a couple of dollars more than expected"", your budget would still become negative. Please, contact us at support@pocketguard.com, so we could help you adjust your budget. Have a great day!",2020-09-29 11:49:35,4.7,en,us
Google Play,48ea3f7b-5323-4b47-b18f-c76a210f510a,Adam King,,Took away the ability to see more than 3 months of history and made it a paid Pro feature. I still like this app but this was a very shady and greedy move on the developers part.,3,1,2020-11-27 09:13:26,,,4.7,en,us
Google Play,8ef2d2ab-b654-4ebd-b2e8-ace53dfeab65,Kathryn Norman,,"Great app overall, kinda disappointed you have to pay for more than 3 budgets though, seems like a basic app function not a premium one. Taking away a star because they keep putting more and more features behind a paywall. Very disappointed.",2,8,2020-11-26 17:19:50,,,4.7,en,us
Google Play,2123bc02-0e85-46c2-931e-ed443ca23a61,Rocky,,"So now the free version only allows you to view 3 months of spending and details at a time. If the app started that way, fine but now you're taking away features to force the pro version? It's a great app and their customer service is great too but I'll be looking elsewhere.",2,6,2020-11-24 06:28:47,"Hi Rocky! Thank you for your feedback. In the free version, we allow just enough features to create a budget. You can link your bank, create one savings goal, view 3 months of transactions' history, and track your spending. More functionality, like custom categories, cash tracking, 6 months of spending, etc. is available with PocketGuard Plus.",2020-11-24 13:14:19,4.7,en,us
Google Play,88f145bc-b8e6-4465-9d34-c68252126d43,Alex Wiggs,,Great way to budget. I like the average dollars per day feature so you have a target to stay within each day.,5,1,2020-11-23 17:04:44,Hi Alex! Thank you for your feedback. Have a wonderful day!,2020-11-24 13:08:27,4.6,en,us
Google Play,76a6ea59-aa91-4c66-b567-2ce154643ed0,Laura Lynn,,"I really like this app, it helps me to see what I bought and label everything, but currently, it tells me the app is not working and keeps crashing. It also keeps disconnecting my bank account. Idk if it's my phone or the app so I only took off one star 🥴🙃",4,0,2020-11-22 00:07:01,"Hi Laura! Sorry for the inconvenience. Please, email us at support@pocketguard.com, so we could dig deeper into the issue and resolve it as soon as possible.",2020-11-23 16:12:02,4.6,en,us
Google Play,7be03a45-2305-47ca-ad3e-b8291f8977f7,Romina Melgarejo,,Pretty happy with this app so far. Very detailed and easy to understand. Alert of when ive gone over my alloted spending for each category keep me in check,5,0,2020-11-20 02:05:59,Hi Romina! Thank you for your feedback =),2020-11-20 11:58:30,4.6,en,us
Google Play,7776cba4-5585-4cc6-a5f3-597dc9ccaffc,Tony Jarrell,,Required to connect bank accounts.,1,0,2020-11-19 18:04:59,"Hi Tony! PocketGuard is an automatic personal finance management application that makes it easy to take control of your money, optimize your spending, and grow savings. To do all of that, we pull all your financial data directly from your financial institution into the app. That means, PocketGuard cannot be used without linking your bank.",2020-11-20 11:57:43,4.6,en,us
